{
  "artifact_class": "a0x-selection-manifest",
  "cases": [
    {
      "case_content_sha256": "7dd2df69778af7bdcc6d6a8e36a258657f4db8eb927226cb009d00e05a332803",
      "case_id": "case_agriculture_009_variant_a",
      "domain": "agriculture",
      "problem_family_id": "agriculture_009",
      "split": "sealed"
    },
    {
      "case_content_sha256": "9c14e7fedcd7f293da99eab73963bef8e12a11bae9987406d32d578b6e9f3c80",
      "case_id": "case_agriculture_009_variant_b",
      "domain": "agriculture",
      "problem_family_id": "agriculture_009",
      "split": "sealed"
    },
    {
      "case_content_sha256": "92431994e5050646303d8c7532a7dde46d3702ed47e7c02f936f76beee03d867",
      "case_id": "case_agriculture_010_variant_a",
      "domain": "agriculture",
      "problem_family_id": "agriculture_010",
      "split": "sealed"
    },
    {
      "case_content_sha256": "d2de1215ccf145219012da0dca1e8227ed848799bae088be78b4cebb70fe9ee7",
      "case_id": "case_agriculture_010_variant_b",
      "domain": "agriculture",
      "problem_family_id": "agriculture_010",
      "split": "sealed"
    },
    {
      "case_content_sha256": "9c0bb8a01459c93e8d01cdb0651d83a7333c843f88f1b5e748a046dbc6e37fa0",
      "case_id": "case_agriculture_011_variant_a",
      "domain": "agriculture",
      "problem_family_id": "agriculture_011",
      "split": "sealed"
    },
    {
      "case_content_sha256": "ab2a6e6e5f0bb166a49b6998efabd96cba357a99211a2477e71b4f73a522ba70",
      "case_id": "case_agriculture_011_variant_b",
      "domain": "agriculture",
      "problem_family_id": "agriculture_011",
      "split": "sealed"
    },
    {
      "case_content_sha256": "6fccecf0ff20c366b3eab8022fc91dc8ebc2055c93fce956c72a74112dd99d77",
      "case_id": "case_agriculture_012_variant_a",
      "domain": "agriculture",
      "problem_family_id": "agriculture_012",
      "split": "sealed"
    },
    {
      "case_content_sha256": "857b88c2690bcedd333792483ac040f0069f6350d3e6d02f102fafecfa4df4d4",
      "case_id": "case_agriculture_012_variant_b",
      "domain": "agriculture",
      "problem_family_id": "agriculture_012",
      "split": "sealed"
    },
    {
      "case_content_sha256": "a355932f78c567a7daa79fadd796b76a58e4ae967258992f3799f0e59137b6be",
      "case_id": "case_energy_009_variant_a",
      "domain": "energy",
      "problem_family_id": "energy_009",
      "split": "sealed"
    },
    {
      "case_content_sha256": "3a8c8faea42aa3c899b77bc43fe68eb1f4bc0a8d0f223f78c6db853d2230a96e",
      "case_id": "case_energy_009_variant_b",
      "domain": "energy",
      "problem_family_id": "energy_009",
      "split": "sealed"
    },
    {
      "case_content_sha256": "30486139ed16f333c6639625f72ca0eae5c1baa47006ccffd0a5c25145296a4e",
      "case_id": "case_energy_010_variant_a",
      "domain": "energy",
      "problem_family_id": "energy_010",
      "split": "sealed"
    },
    {
      "case_content_sha256": "5dd79a0a1920def2e693ba5f51c774d8af567e281bd0e19b61fdc6a03a4eb5d1",
      "case_id": "case_energy_010_variant_b",
      "domain": "energy",
      "problem_family_id": "energy_010",
      "split": "sealed"
    },
    {
      "case_content_sha256": "f1cf77d9da789879f69aee8fee4df88365d90f18cf88efce64a2806768bebc7a",
      "case_id": "case_energy_011_variant_a",
      "domain": "energy",
      "problem_family_id": "energy_011",
      "split": "sealed"
    },
    {
      "case_content_sha256": "97734564f3d46aef03edb124d3df55918aa8511a7f7319b1a8a42e4e236b4dc0",
      "case_id": "case_energy_011_variant_b",
      "domain": "energy",
      "problem_family_id": "energy_011",
      "split": "sealed"
    },
    {
      "case_content_sha256": "285d84a589f51fd017288db8570a21d653e445e7f192ed7fe0f25b4f1357bfc1",
      "case_id": "case_energy_012_variant_a",
      "domain": "energy",
      "problem_family_id": "energy_012",
      "split": "sealed"
    },
    {
      "case_content_sha256": "4b54bb7fa41f94299d264fc1490d26d8db4f60b336dc9c489749c0fb7adbccd9",
      "case_id": "case_energy_012_variant_b",
      "domain": "energy",
      "problem_family_id": "energy_012",
      "split": "sealed"
    },
    {
      "case_content_sha256": "30622985b5936b2a661323b40722828cb84ec693717c8feb55b08abe209bc645",
      "case_id": "case_manufacturing_009_variant_a",
      "domain": "manufacturing",
      "problem_family_id": "manufacturing_009",
      "split": "sealed"
    },
    {
      "case_content_sha256": "2328709014864ac3165cb5c2d5efb5e7131228bdf7ae557e51a915ab58bc1322",
      "case_id": "case_manufacturing_009_variant_b",
      "domain": "manufacturing",
      "problem_family_id": "manufacturing_009",
      "split": "sealed"
    },
    {
      "case_content_sha256": "05c4105be66046483fd60d385db028b4d3830ab3399237400f903fc24090fc37",
      "case_id": "case_manufacturing_010_variant_a",
      "domain": "manufacturing",
      "problem_family_id": "manufacturing_010",
      "split": "sealed"
    },
    {
      "case_content_sha256": "8e0ce7db824e0192e51f7d805b2da85cea2913423ef11919d7f88d6f271dd236",
      "case_id": "case_manufacturing_010_variant_b",
      "domain": "manufacturing",
      "problem_family_id": "manufacturing_010",
      "split": "sealed"
    },
    {
      "case_content_sha256": "2c53a07544ce3f5affdd106c0c25974f91385a336c1b1131764ad60e069197a2",
      "case_id": "case_manufacturing_011_variant_a",
      "domain": "manufacturing",
      "problem_family_id": "manufacturing_011",
      "split": "sealed"
    },
    {
      "case_content_sha256": "27d46b0b3bc0eccfb40e9f16fda96f4a45efb8dce5dc5f90b58584bbd006f8fd",
      "case_id": "case_manufacturing_011_variant_b",
      "domain": "manufacturing",
      "problem_family_id": "manufacturing_011",
      "split": "sealed"
    },
    {
      "case_content_sha256": "b80f9b7be5576640793cb16653d8288ef0a360ae63d9523f834395d7ac1ea995",
      "case_id": "case_manufacturing_012_variant_a",
      "domain": "manufacturing",
      "problem_family_id": "manufacturing_012",
      "split": "sealed"
    },
    {
      "case_content_sha256": "5b8e36d946ac246426067751dc12988411150d1c309e05b8af798d66d540d2eb",
      "case_id": "case_manufacturing_012_variant_b",
      "domain": "manufacturing",
      "problem_family_id": "manufacturing_012",
      "split": "sealed"
    },
    {
      "case_content_sha256": "cb2b52c4011458d658bca198c814f1e9e73df0f7225b6e5c40506c8ee6562b6c",
      "case_id": "case_medicine_009_variant_a",
      "domain": "medicine",
      "problem_family_id": "medicine_009",
      "split": "sealed"
    },
    {
      "case_content_sha256": "70bca2654484f1c57e5e308843c4535c6dfa1ddc80a5e8262651bbc29a38d67c",
      "case_id": "case_medicine_009_variant_b",
      "domain": "medicine",
      "problem_family_id": "medicine_009",
      "split": "sealed"
    },
    {
      "case_content_sha256": "429416ca99e38a31eed386cc79e2a5a894998c591945a54cbfd071bfd4e13803",
      "case_id": "case_medicine_010_variant_a",
      "domain": "medicine",
      "problem_family_id": "medicine_010",
      "split": "sealed"
    },
    {
      "case_content_sha256": "697dbed1e284c162a7c16c4c8dd07215c997e73f27d304986faed3b44f0f146f",
      "case_id": "case_medicine_010_variant_b",
      "domain": "medicine",
      "problem_family_id": "medicine_010",
      "split": "sealed"
    },
    {
      "case_content_sha256": "7def741a38754fa412d9ccb7ecc5cec95602483524d19c612bcad1682daaf4cc",
      "case_id": "case_medicine_011_variant_a",
      "domain": "medicine",
      "problem_family_id": "medicine_011",
      "split": "sealed"
    },
    {
      "case_content_sha256": "50c65c0a14f691e0efaebe4ff07197867933f21f0233784d58536e4ba48d2c74",
      "case_id": "case_medicine_011_variant_b",
      "domain": "medicine",
      "problem_family_id": "medicine_011",
      "split": "sealed"
    },
    {
      "case_content_sha256": "4c421d0035d95cdb8e5728b2fffac034de62053e31467b7dcdf0ab6a0ef09aba",
      "case_id": "case_medicine_012_variant_a",
      "domain": "medicine",
      "problem_family_id": "medicine_012",
      "split": "sealed"
    },
    {
      "case_content_sha256": "a5d6d2c1647d0cbd6c3477a23d9bbe7ef53ccf500c4070801e1af1994e3252b2",
      "case_id": "case_medicine_012_variant_b",
      "domain": "medicine",
      "problem_family_id": "medicine_012",
      "split": "sealed"
    },
    {
      "case_content_sha256": "0aec4ada229fc2bf994d5f29c6031eb5fa43bcec31fa896c0d7e8b85e207a6bd",
      "case_id": "case_software_009_variant_a",
      "domain": "software",
      "problem_family_id": "software_009",
      "split": "sealed"
    },
    {
      "case_content_sha256": "5d3df03e13a096b347bbbeaea2bd56c821bfb42da6e9548fbcc9dc2bbb20938f",
      "case_id": "case_software_009_variant_b",
      "domain": "software",
      "problem_family_id": "software_009",
      "split": "sealed"
    },
    {
      "case_content_sha256": "2608d708c43e0822a3c2a39ef1fe649c43596d6473b4ba4ee013e60b9b01227a",
      "case_id": "case_software_010_variant_a",
      "domain": "software",
      "problem_family_id": "software_010",
      "split": "sealed"
    },
    {
      "case_content_sha256": "6ebccaf8a2475e61a1a4bf2c270ae22230c6be1873ede96ebc38522d46e5d695",
      "case_id": "case_software_010_variant_b",
      "domain": "software",
      "problem_family_id": "software_010",
      "split": "sealed"
    },
    {
      "case_content_sha256": "624be1a185c48364d8da5de02f9b8632a5964d6bdcc661a2938a1a6482a707d2",
      "case_id": "case_software_011_variant_a",
      "domain": "software",
      "problem_family_id": "software_011",
      "split": "sealed"
    },
    {
      "case_content_sha256": "68a0864d2a4772f564eca6b761df8226748f647156b8d7fec41ff6b57c6b4951",
      "case_id": "case_software_011_variant_b",
      "domain": "software",
      "problem_family_id": "software_011",
      "split": "sealed"
    },
    {
      "case_content_sha256": "5d0782b21a77c73205f7a6b8eb4642d9ff46424355f14ccda0bfdf6d5cd40aae",
      "case_id": "case_software_012_variant_a",
      "domain": "software",